"No.","Time","Source","Destination","Protocol","Length","Info","ACK RTT "
"330","8.643521588","rust-bucket.local","151.101.38.214","TCP","66","43784  >  443 [ACK] Seq=1 Ack=1 Win=4549 Len=0 TSval=1266380372 TSecr=2046860585",""
"345","8.852814900","151.101.38.214","rust-bucket.local","TCP","66","[TCP ACKed unseen segment] 443  >  43784 [ACK] Seq=1 Ack=2 Win=99 Len=0 TSval=2046872262 TSecr=1266149295",""
"419","9.882894416","rust-bucket.local","151.101.38.214","TLSv1.2","156","[TCP Previous segment not captured] , Application Data",""
"420","9.883713909","rust-bucket.local","151.101.38.214","TLSv1.2","112","Application Data",""
"421","9.908762450","rust-bucket.local","151.101.38.214","TLSv1.2","160","Application Data",""
"422","10.100226881","rust-bucket.local","151.101.38.214","TLSv1.2","109","Application Data",""
"423","10.121417971","151.101.38.214","rust-bucket.local","TCP","66","[TCP ACKed unseen segment] 443  >  43784 [ACK] Seq=1 Ack=232 Win=99 Len=0 TSval=2046872578 TSecr=1266381612","0.212655521"
"424","10.121491922","151.101.38.214","rust-bucket.local","TLSv1.2","112","Application Data",""
"425","10.121519322","rust-bucket.local","151.101.38.214","TCP","66","43784  >  443 [ACK] Seq=275 Ack=47 Win=4549 Len=0 TSval=1266381850 TSecr=2046872578","0.000027400"
"426","10.130420069","151.101.38.214","rust-bucket.local","TCP","1454","443  >  43784 [ACK] Seq=47 Ack=232 Win=99 Len=1388 TSval=2046872578 TSecr=1266381612 [TCP segment of a reassembled PDU]",""
"427","10.130484032","rust-bucket.local","151.101.38.214","TCP","66","43784  >  443 [ACK] Seq=275 Ack=1435 Win=4549 Len=0 TSval=1266381859 TSecr=2046872578","0.000063963"
"428","10.130658795","151.101.38.214","rust-bucket.local","TCP","1454","443  >  43784 [ACK] Seq=1435 Ack=232 Win=99 Len=1388 TSval=2046872578 TSecr=1266381612 [TCP segment of a reassembled PDU]",""
"429","10.130675295","rust-bucket.local","151.101.38.214","TCP","66","43784  >  443 [ACK] Seq=275 Ack=2823 Win=4549 Len=0 TSval=1266381859 TSecr=2046872578","0.000016500"
"430","10.131350950","151.101.38.214","rust-bucket.local","TLSv1.2","78","Application Data",""
"431","10.131401900","rust-bucket.local","151.101.38.214","TCP","66","43784  >  443 [ACK] Seq=275 Ack=2835 Win=4549 Len=0 TSval=1266381860 TSecr=2046872578","0.000050950"
"432","10.131472938","151.101.38.214","rust-bucket.local","TLSv1.2","2854","Application Data",""
"433","10.131485651","rust-bucket.local","151.101.38.214","TCP","66","43784  >  443 [ACK] Seq=275 Ack=5623 Win=4528 Len=0 TSval=1266381860 TSecr=2046872578","0.000012713"
"434","10.131503988","151.101.38.214","rust-bucket.local","TCP","1454","443  >  43784 [ACK] Seq=5623 Ack=232 Win=99 Len=1388 TSval=2046872578 TSecr=1266381612 [TCP segment of a reassembled PDU]",""
"435","10.131523889","rust-bucket.local","151.101.38.214","TCP","66","43784  >  443 [ACK] Seq=275 Ack=7011 Win=4518 Len=0 TSval=1266381860 TSecr=2046872578","0.000019901"
"436","10.131674302","151.101.38.214","rust-bucket.local","TLSv1.2","1466","Application Data",""
"437","10.131694652","rust-bucket.local","151.101.38.214","TCP","66","43784  >  443 [ACK] Seq=275 Ack=8411 Win=4508 Len=0 TSval=1266381860 TSecr=2046872578","0.000020350"
"438","10.131859016","151.101.38.214","rust-bucket.local","TCP","1454","443  >  43784 [ACK] Seq=8411 Ack=232 Win=99 Len=1388 TSval=2046872578 TSecr=1266381612 [TCP segment of a reassembled PDU]",""
"439","10.131874416","rust-bucket.local","151.101.38.214","TCP","66","43784  >  443 [ACK] Seq=275 Ack=9799 Win=4549 Len=0 TSval=1266381861 TSecr=2046872578","0.000015400"
"440","10.132148855","151.101.38.214","rust-bucket.local","TCP","1454","443  >  43784 [ACK] Seq=9799 Ack=232 Win=99 Len=1388 TSval=2046872578 TSecr=1266381612 [TCP segment of a reassembled PDU]",""
"441","10.132172568","rust-bucket.local","151.101.38.214","TCP","66","43784  >  443 [ACK] Seq=275 Ack=11187 Win=4539 Len=0 TSval=1266381861 TSecr=2046872578","0.000023713"
"442","10.132242081","151.101.38.214","rust-bucket.local","TLSv1.2","78","Application Data",""
"443","10.132254393","rust-bucket.local","151.101.38.214","TCP","66","43784  >  443 [ACK] Seq=275 Ack=11199 Win=4539 Len=0 TSval=1266381861 TSecr=2046872578","0.000012312"
"444","10.137118913","151.101.38.214","rust-bucket.local","TCP","1454","443  >  43784 [ACK] Seq=11199 Ack=232 Win=99 Len=1388 TSval=2046872578 TSecr=1266381612 [TCP segment of a reassembled PDU]",""
"445","10.137191526","rust-bucket.local","151.101.38.214","TCP","66","43784  >  443 [ACK] Seq=275 Ack=12587 Win=4549 Len=0 TSval=1266381866 TSecr=2046872578","0.000072613"
"446","10.137319527","151.101.38.214","rust-bucket.local","TCP","1454","443  >  43784 [ACK] Seq=12587 Ack=232 Win=99 Len=1388 TSval=2046872578 TSecr=1266381612 [TCP segment of a reassembled PDU]",""
"447","10.137338189","rust-bucket.local","151.101.38.214","TCP","66","43784  >  443 [ACK] Seq=275 Ack=13975 Win=4539 Len=0 TSval=1266381866 TSecr=2046872578","0.000018662"
"448","10.138184807","151.101.38.214","rust-bucket.local","TLSv1.2","78","Application Data",""
"449","10.138260295","rust-bucket.local","151.101.38.214","TCP","66","43784  >  443 [ACK] Seq=275 Ack=13987 Win=4539 Len=0 TSval=1266381867 TSecr=2046872578","0.000075488"
"450","10.138308171","151.101.38.214","rust-bucket.local","TLSv1.2","2684","Application Data",""
"451","10.138320521","rust-bucket.local","151.101.38.214","TCP","66","43784  >  443 [ACK] Seq=275 Ack=16605 Win=4519 Len=0 TSval=1266381867 TSecr=2046872578","0.000012350"
"452","10.138344558","151.101.38.214","rust-bucket.local","TLSv1.2","2854","Application Data",""
"453","10.138370059","rust-bucket.local","151.101.38.214","TCP","66","43784  >  443 [ACK] Seq=275 Ack=19393 Win=4498 Len=0 TSval=1266381867 TSecr=2046872578","0.000025501"
"454","10.138563910","151.101.38.214","rust-bucket.local","TLSv1.2","2854","Application Data",""
"455","10.138585685","rust-bucket.local","151.101.38.214","TCP","66","43784  >  443 [ACK] Seq=275 Ack=22181 Win=4477 Len=0 TSval=1266381867 TSecr=2046872578","0.000021775"
"456","10.139042763","151.101.38.214","rust-bucket.local","TCP","2842","443  >  43784 [ACK] Seq=22181 Ack=232 Win=99 Len=2776 TSval=2046872578 TSecr=1266381612 [TCP segment of a reassembled PDU]",""
"457","10.139103788","151.101.38.214","rust-bucket.local","TLSv1.2","78","Application Data",""
"458","10.139407665","151.101.38.214","rust-bucket.local","TCP","1454","443  >  43784 [ACK] Seq=24969 Ack=232 Win=99 Len=1388 TSval=2046872578 TSecr=1266381612 [TCP segment of a reassembled PDU]",""
"459","10.140386897","rust-bucket.local","151.101.38.214","TCP","66","43784  >  443 [ACK] Seq=275 Ack=26357 Win=4549 Len=0 TSval=1266381869 TSecr=2046872578","0.000979232"
"460","10.149855210","151.101.38.214","rust-bucket.local","TCP","1454","443  >  43784 [ACK] Seq=26357 Ack=232 Win=99 Len=1388 TSval=2046872578 TSecr=1266381612 [TCP segment of a reassembled PDU]",""
"461","10.149929310","151.101.38.214","rust-bucket.local","TLSv1.2","78","Application Data",""
"462","10.150043786","rust-bucket.local","151.101.38.214","TCP","66","43784  >  443 [ACK] Seq=275 Ack=27757 Win=4549 Len=0 TSval=1266381879 TSecr=2046872578","0.000114476"
"463","10.151457820","151.101.38.214","rust-bucket.local","TCP","1454","443  >  43784 [ACK] Seq=27757 Ack=232 Win=99 Len=1388 TSval=2046872578 TSecr=1266381612 [TCP segment of a reassembled PDU]",""
"464","10.156988832","151.101.38.214","rust-bucket.local","TLSv1.2","1466","Application Data",""
"465","10.157041882","151.101.38.214","rust-bucket.local","TLSv1.2","417","Application Data",""
"466","10.159270835","rust-bucket.local","151.101.38.214","TCP","66","43784  >  443 [ACK] Seq=275 Ack=30896 Win=4549 Len=0 TSval=1266381888 TSecr=2046872578","0.002228953"
"467","10.161463937","151.101.38.214","rust-bucket.local","TCP","1454","443  >  43784 [ACK] Seq=30896 Ack=232 Win=99 Len=1388 TSval=2046872578 TSecr=1266381612 [TCP segment of a reassembled PDU]",""
"468","10.161707601","151.101.38.214","rust-bucket.local","TCP","1454","443  >  43784 [ACK] Seq=32284 Ack=232 Win=99 Len=1388 TSval=2046872578 TSecr=1266381612 [TCP segment of a reassembled PDU]",""
"469","10.161830402","rust-bucket.local","151.101.38.214","TCP","66","43784  >  443 [ACK] Seq=275 Ack=33672 Win=4549 Len=0 TSval=1266381891 TSecr=2046872578","0.000122801"
"470","10.162383743","151.101.38.214","rust-bucket.local","TCP","4230","443  >  43784 [ACK] Seq=33672 Ack=232 Win=99 Len=4164 TSval=2046872578 TSecr=1266381612 [TCP segment of a reassembled PDU]",""
"471","10.162589219","151.101.38.214","rust-bucket.local","TCP","1454","443  >  43784 [ACK] Seq=37836 Ack=232 Win=99 Len=1388 TSval=2046872578 TSecr=1266381612 [TCP segment of a reassembled PDU]",""
"472","10.162881984","151.101.38.214","rust-bucket.local","TCP","1454","443  >  43784 [ACK] Seq=39224 Ack=232 Win=99 Len=1388 TSval=2046872578 TSecr=1266381612 [TCP segment of a reassembled PDU]",""
"473","10.163162623","151.101.38.214","rust-bucket.local","TCP","1454","443  >  43784 [ACK] Seq=40612 Ack=232 Win=99 Len=1388 TSval=2046872578 TSecr=1266381612 [TCP segment of a reassembled PDU]",""
"474","10.163858165","rust-bucket.local","151.101.38.214","TCP","66","43784  >  443 [ACK] Seq=275 Ack=42000 Win=4549 Len=0 TSval=1266381893 TSecr=2046872578","0.000695542"
"475","10.167100337","151.101.38.214","rust-bucket.local","TCP","1454","443  >  43784 [ACK] Seq=42000 Ack=232 Win=99 Len=1388 TSval=2046872578 TSecr=1266381612 [TCP segment of a reassembled PDU]",""
"476","10.167375076","151.101.38.214","rust-bucket.local","TCP","1454","443  >  43784 [ACK] Seq=43388 Ack=232 Win=99 Len=1388 TSval=2046872578 TSecr=1266381612 [TCP segment of a reassembled PDU]",""
"477","10.167807666","151.101.38.214","rust-bucket.local","TLSv1.2","2599","Application Data",""
"478","10.168059218","151.101.38.214","rust-bucket.local","TCP","1454","443  >  43784 [ACK] Seq=47309 Ack=232 Win=99 Len=1388 TSval=2046872578 TSecr=1266381612 [TCP segment of a reassembled PDU]",""
"479","10.168418333","151.101.38.214","rust-bucket.local","TCP","1454","443  >  43784 [ACK] Seq=48697 Ack=232 Win=99 Len=1388 TSval=2046872578 TSecr=1266381612 [TCP segment of a reassembled PDU]",""
"480","10.168600934","151.101.38.214","rust-bucket.local","TCP","1454","443  >  43784 [ACK] Seq=50085 Ack=232 Win=99 Len=1388 TSval=2046872578 TSecr=1266381612 [TCP segment of a reassembled PDU]",""
"481","10.173982857","151.101.38.214","rust-bucket.local","TCP","1454","443  >  43784 [ACK] Seq=51473 Ack=232 Win=99 Len=1388 TSval=2046872578 TSecr=1266381612 [TCP segment of a reassembled PDU]",""
"482","10.174597161","rust-bucket.local","151.101.38.214","TCP","66","43784  >  443 [ACK] Seq=275 Ack=52861 Win=4549 Len=0 TSval=1266381903 TSecr=2046872578","0.000614304"
"483","10.175174990","151.101.38.214","rust-bucket.local","TCP","1454","443  >  43784 [ACK] Seq=52861 Ack=232 Win=99 Len=1388 TSval=2046872578 TSecr=1266381612 [TCP segment of a reassembled PDU]",""
"484","10.175364679","151.101.38.214","rust-bucket.local","TCP","1454","443  >  43784 [ACK] Seq=54249 Ack=232 Win=99 Len=1388 TSval=2046872578 TSecr=1266381612 [TCP segment of a reassembled PDU]",""
"485","10.177229229","rust-bucket.local","151.101.38.214","TCP","66","43784  >  443 [ACK] Seq=275 Ack=55637 Win=4549 Len=0 TSval=1266381906 TSecr=2046872578","0.001864550"
"486","10.179634920","151.101.38.214","rust-bucket.local","TCP","1454","443  >  43784 [ACK] Seq=55637 Ack=232 Win=99 Len=1388 TSval=2046872578 TSecr=1266381612 [TCP segment of a reassembled PDU]",""
"487","10.179718695","151.101.38.214","rust-bucket.local","TLSv1.2","201","Application Data",""
"488","10.179925621","rust-bucket.local","151.101.38.214","TCP","66","43784  >  443 [ACK] Seq=275 Ack=57160 Win=4549 Len=0 TSval=1266381909 TSecr=2046872578","0.000206926"
"489","10.221293796","rust-bucket.local","151.101.38.214","TLSv1.2","163","Application Data",""
"490","10.221623785","rust-bucket.local","151.101.38.214","TLSv1.2","159","Application Data",""
"491","10.278586125","rust-bucket.local","151.101.38.214","TLSv1.2","158","Application Data",""
"492","10.295797627","rust-bucket.local","151.101.38.214","TLSv1.2","159","Application Data",""
"493","10.295962165","rust-bucket.local","151.101.38.214","TLSv1.2","182","Application Data",""
"495","10.338433234","rust-bucket.local","151.101.38.214","TLSv1.2","161","Application Data",""
"496","10.353316558","rust-bucket.local","151.101.38.214","TLSv1.2","158","Application Data",""
"497","10.353544084","rust-bucket.local","151.101.38.214","TLSv1.2","251","Application Data, Application Data",""
"508","10.360442017","151.101.38.214","rust-bucket.local","TCP","66","443  >  43784 [ACK] Seq=57160 Ack=275 Win=99 Len=0 TSval=2046872634 TSecr=1266381829","0.260215136"
"509","10.417479183","151.101.38.214","rust-bucket.local","TCP","66","443  >  43784 [ACK] Seq=57160 Ack=465 Win=99 Len=0 TSval=2046872653 TSecr=1266381950","0.195855398"
"510","10.429067935","151.101.38.214","rust-bucket.local","TCP","1454","443  >  43784 [ACK] Seq=57160 Ack=465 Win=99 Len=1388 TSval=2046872653 TSecr=1266381950 [TCP segment of a reassembled PDU]",""
"511","10.429311586","151.101.38.214","rust-bucket.local","TCP","1454","443  >  43784 [ACK] Seq=58548 Ack=465 Win=99 Len=1388 TSval=2046872653 TSecr=1266381950 [TCP segment of a reassembled PDU]",""
"512","10.429349511","rust-bucket.local","151.101.38.214","TCP","66","43784  >  443 [ACK] Seq=1138 Ack=59936 Win=4549 Len=0 TSval=1266382158 TSecr=2046872653","0.000037925"
"513","10.429578625","151.101.38.214","rust-bucket.local","TCP","1454","443  >  43784 [ACK] Seq=59936 Ack=465 Win=99 Len=1388 TSval=2046872653 TSecr=1266381950 [TCP segment of a reassembled PDU]",""
"515","10.434703284","151.101.38.214","rust-bucket.local","TCP","1454","443  >  43784 [ACK] Seq=61324 Ack=465 Win=99 Len=1388 TSval=2046872653 TSecr=1266381950 [TCP segment of a reassembled PDU]",""
"516","10.434783260","rust-bucket.local","151.101.38.214","TCP","66","43784  >  443 [ACK] Seq=1138 Ack=62712 Win=4549 Len=0 TSval=1266382163 TSecr=2046872653","0.000079976"
"517","10.434889661","151.101.38.214","rust-bucket.local","TCP","1454","443  >  43784 [ACK] Seq=62712 Ack=465 Win=99 Len=1388 TSval=2046872653 TSecr=1266381950 [TCP segment of a reassembled PDU]",""
"518","10.435190025","151.101.38.214","rust-bucket.local","TCP","1454","443  >  43784 [ACK] Seq=64100 Ack=465 Win=99 Len=1388 TSval=2046872653 TSecr=1266381950 [TCP segment of a reassembled PDU]",""
"519","10.435498002","151.101.38.214","rust-bucket.local","TCP","1454","443  >  43784 [ACK] Seq=65488 Ack=465 Win=99 Len=1388 TSval=2046872653 TSecr=1266381950 [TCP segment of a reassembled PDU]",""
"520","10.443311891","151.101.38.214","rust-bucket.local","TCP","2842","443  >  43784 [ACK] Seq=66876 Ack=465 Win=99 Len=2776 TSval=2046872653 TSecr=1266381950 [TCP segment of a reassembled PDU]",""
"521","10.443539180","151.101.38.214","rust-bucket.local","TCP","1454","443  >  43784 [ACK] Seq=69652 Ack=465 Win=99 Len=1388 TSval=2046872653 TSecr=1266381950 [TCP segment of a reassembled PDU]",""
"522","10.443823770","151.101.38.214","rust-bucket.local","TCP","1454","443  >  43784 [ACK] Seq=71040 Ack=465 Win=99 Len=1388 TSval=2046872653 TSecr=1266381950 [TCP segment of a reassembled PDU]",""
"523","10.444069359","151.101.38.214","rust-bucket.local","TLSv1.2","1211","Application Data",""
"524","10.446569201","151.101.38.214","rust-bucket.local","TCP","1454","443  >  43784 [ACK] Seq=73573 Ack=465 Win=99 Len=1388 TSval=2046872653 TSecr=1266381950 [TCP segment of a reassembled PDU]",""
"525","10.446826827","151.101.38.214","rust-bucket.local","TCP","1454","443  >  43784 [ACK] Seq=74961 Ack=465 Win=99 Len=1388 TSval=2046872653 TSecr=1266381950 [TCP segment of a reassembled PDU]",""
"526","10.447512269","151.101.38.214","rust-bucket.local","TCP","4230","443  >  43784 [ACK] Seq=76349 Ack=465 Win=99 Len=4164 TSval=2046872653 TSecr=1266381950 [TCP segment of a reassembled PDU]",""
"527","10.447906310","151.101.38.214","rust-bucket.local","TCP","2842","443  >  43784 [ACK] Seq=80513 Ack=465 Win=99 Len=2776 TSval=2046872653 TSecr=1266381950 [TCP segment of a reassembled PDU]",""
"528","10.448166174","151.101.38.214","rust-bucket.local","TCP","1454","443  >  43784 [ACK] Seq=83289 Ack=465 Win=99 Len=1388 TSval=2046872653 TSecr=1266381950 [TCP segment of a reassembled PDU]",""
"529","10.448307325","151.101.38.214","rust-bucket.local","TLSv1.2","551","Application Data",""
"530","10.453519934","151.101.38.214","rust-bucket.local","TCP","1454","443  >  43784 [ACK] Seq=85162 Ack=465 Win=99 Len=1388 TSval=2046872653 TSecr=1266381950 [TCP segment of a reassembled PDU]",""
"531","10.456602205","rust-bucket.local","151.101.38.214","TCP","66","43784  >  443 [ACK] Seq=1138 Ack=86550 Win=4363 Len=0 TSval=1266382185 TSecr=2046872653","0.003082271"
"532","10.461178585","151.101.38.214","rust-bucket.local","TCP","1454","443  >  43784 [ACK] Seq=86550 Ack=465 Win=99 Len=1388 TSval=2046872653 TSecr=1266381950 [TCP segment of a reassembled PDU]",""
"533","10.461418961","151.101.38.214","rust-bucket.local","TCP","1454","443  >  43784 [ACK] Seq=87938 Ack=465 Win=99 Len=1388 TSval=2046872653 TSecr=1266381950 [TCP segment of a reassembled PDU]",""
"534","10.461449387","rust-bucket.local","151.101.38.214","TCP","66","43784  >  443 [ACK] Seq=1138 Ack=89326 Win=4533 Len=0 TSval=1266382190 TSecr=2046872653","0.000030426"
"535","10.462100528","151.101.38.214","rust-bucket.local","TCP","4230","443  >  43784 [ACK] Seq=89326 Ack=465 Win=99 Len=4164 TSval=2046872653 TSecr=1266381950 [TCP segment of a reassembled PDU]",""
"536","10.462302617","151.101.38.214","rust-bucket.local","TCP","1454","443  >  43784 [ACK] Seq=93490 Ack=465 Win=99 Len=1388 TSval=2046872653 TSecr=1266381950 [TCP segment of a reassembled PDU]",""
"537","10.462589419","151.101.38.214","rust-bucket.local","TCP","1454","443  >  43784 [ACK] Seq=94878 Ack=465 Win=99 Len=1388 TSval=2046872653 TSecr=1266381950 [TCP segment of a reassembled PDU]",""
"538","10.462885271","151.101.38.214","rust-bucket.local","TCP","1454","443  >  43784 [ACK] Seq=96266 Ack=465 Win=99 Len=1388 TSval=2046872653 TSecr=1266381950 [TCP segment of a reassembled PDU]",""
"539","10.466754122","151.101.38.214","rust-bucket.local","TCP","1454","443  >  43784 [ACK] Seq=97654 Ack=465 Win=99 Len=1388 TSval=2046872653 TSecr=1266381950 [TCP segment of a reassembled PDU]",""
"540","10.467019361","151.101.38.214","rust-bucket.local","TCP","1454","443  >  43784 [ACK] Seq=99042 Ack=465 Win=99 Len=1388 TSval=2046872653 TSecr=1266381950 [TCP segment of a reassembled PDU]",""
"541","10.467493114","151.101.38.214","rust-bucket.local","TLSv1.2","1211","Application Data",""
"542","10.467537689","151.101.38.214","rust-bucket.local","TCP","1454","443  >  43784 [ACK] Seq=101575 Ack=465 Win=99 Len=1388 TSval=2046872653 TSecr=1266381950 [TCP segment of a reassembled PDU]",""
"543","10.467705366","151.101.38.214","rust-bucket.local","TCP","1454","443  >  43784 [ACK] Seq=102963 Ack=465 Win=99 Len=1388 TSval=2046872653 TSecr=1266381950 [TCP segment of a reassembled PDU]",""
"544","10.468009680","151.101.38.214","rust-bucket.local","TCP","1454","443  >  43784 [ACK] Seq=104351 Ack=465 Win=99 Len=1388 TSval=2046872653 TSecr=1266381950 [TCP segment of a reassembled PDU]",""
"545","10.470519947","rust-bucket.local","151.101.38.214","TCP","66","43784  >  443 [ACK] Seq=1138 Ack=105739 Win=4405 Len=0 TSval=1266382199 TSecr=2046872653","0.002510267"
"546","10.474006670","151.101.38.214","rust-bucket.local","TCP","1454","443  >  43784 [ACK] Seq=105739 Ack=465 Win=99 Len=1388 TSval=2046872653 TSecr=1266381950 [TCP segment of a reassembled PDU]",""
"547","10.474266459","151.101.38.214","rust-bucket.local","TCP","1454","443  >  43784 [ACK] Seq=107127 Ack=465 Win=99 Len=1388 TSval=2046872653 TSecr=1266381950 [TCP segment of a reassembled PDU]",""
"548","10.474294759","rust-bucket.local","151.101.38.214","TCP","66","43784  >  443 [ACK] Seq=1138 Ack=108515 Win=4533 Len=0 TSval=1266382203 TSecr=2046872653","0.000028300"
"549","10.474563523","151.101.38.214","rust-bucket.local","TCP","1454","443  >  43784 [ACK] Seq=108515 Ack=465 Win=99 Len=1388 TSval=2046872653 TSecr=1266381950 [TCP segment of a reassembled PDU]",""
"550","10.474665124","151.101.38.214","rust-bucket.local","TLSv1.2","207","Application Data",""
"551","10.481300768","rust-bucket.local","151.101.38.214","TCP","66","43784  >  443 [ACK] Seq=1138 Ack=110044 Win=4549 Len=0 TSval=1266382210 TSecr=2046872653","0.006635644"
"552","10.492560430","151.101.38.214","rust-bucket.local","TCP","1454","443  >  43784 [ACK] Seq=110044 Ack=557 Win=99 Len=1388 TSval=2046872672 TSecr=1266382007 [TCP segment of a reassembled PDU]","0.213974305"
"553","10.505079013","151.101.38.214","rust-bucket.local","TCP","1454","443  >  43784 [ACK] Seq=111432 Ack=557 Win=99 Len=1388 TSval=2046872672 TSecr=1266382007 [TCP segment of a reassembled PDU]",""
"554","10.505129563","rust-bucket.local","151.101.38.214","TCP","66","43784  >  443 [ACK] Seq=1138 Ack=112820 Win=4549 Len=0 TSval=1266382234 TSecr=2046872672","0.000050550"
"555","10.505323452","151.101.38.214","rust-bucket.local","TCP","1454","443  >  43784 [ACK] Seq=112820 Ack=557 Win=99 Len=1388 TSval=2046872672 TSecr=1266382007 [TCP segment of a reassembled PDU]",""
"556","10.505600791","151.101.38.214","rust-bucket.local","TCP","1454","443  >  43784 [ACK] Seq=114208 Ack=557 Win=99 Len=1388 TSval=2046872672 TSecr=1266382007 [TCP segment of a reassembled PDU]",""
"557","10.505628979","rust-bucket.local","151.101.38.214","TCP","66","43784  >  443 [ACK] Seq=1138 Ack=115596 Win=4549 Len=0 TSval=1266382234 TSecr=2046872672","0.000028188"
"558","10.516356238","151.101.38.214","rust-bucket.local","TCP","1454","443  >  43784 [ACK] Seq=115596 Ack=557 Win=99 Len=1388 TSval=2046872672 TSecr=1266382007 [TCP segment of a reassembled PDU]",""
"559","10.516561789","151.101.38.214","rust-bucket.local","TCP","1454","443  >  43784 [ACK] Seq=116984 Ack=557 Win=99 Len=1388 TSval=2046872672 TSecr=1266382007 [TCP segment of a reassembled PDU]",""
"560","10.516602802","rust-bucket.local","151.101.38.214","TCP","66","43784  >  443 [ACK] Seq=1138 Ack=118372 Win=4549 Len=0 TSval=1266382245 TSecr=2046872672","0.000041013"
"561","10.517471832","151.101.38.214","rust-bucket.local","TCP","5618","443  >  43784 [ACK] Seq=118372 Ack=557 Win=99 Len=5552 TSval=2046872672 TSecr=1266382007 [TCP segment of a reassembled PDU]",""
"562","10.517772484","151.101.38.214","rust-bucket.local","TLSv1.2","2599","Application Data",""
"563","10.517809222","rust-bucket.local","151.101.38.214","TCP","66","43784  >  443 [ACK] Seq=1138 Ack=123924 Win=4549 Len=0 TSval=1266382247 TSecr=2046872672","0.000337390"
"564","10.517871798","rust-bucket.local","151.101.38.214","TCP","66","43784  >  443 [ACK] Seq=1138 Ack=126457 Win=4549 Len=0 TSval=1266382247 TSecr=2046872672","0.000099314"
"565","10.518024011","151.101.38.214","rust-bucket.local","TCP","1454","443  >  43784 [ACK] Seq=126457 Ack=557 Win=99 Len=1388 TSval=2046872672 TSecr=1266382007 [TCP segment of a reassembled PDU]",""
"566","10.518316151","151.101.38.214","rust-bucket.local","TCP","1454","443  >  43784 [ACK] Seq=127845 Ack=557 Win=99 Len=1388 TSval=2046872672 TSecr=1266382007 [TCP segment of a reassembled PDU]",""
"567","10.518586702","151.101.38.214","rust-bucket.local","TCP","1454","443  >  43784 [ACK] Seq=129233 Ack=557 Win=99 Len=1388 TSval=2046872672 TSecr=1266382007 [TCP segment of a reassembled PDU]",""
"568","10.518646065","rust-bucket.local","151.101.38.214","TCP","66","43784  >  443 [ACK] Seq=1138 Ack=129233 Win=4549 Len=0 TSval=1266382247 TSecr=2046872672","0.000329914"
"569","10.522221726","151.101.38.214","rust-bucket.local","TCP","1454","443  >  43784 [ACK] Seq=130621 Ack=557 Win=99 Len=1388 TSval=2046872672 TSecr=1266382007 [TCP segment of a reassembled PDU]",""
"570","10.522274027","rust-bucket.local","151.101.38.214","TCP","66","43784  >  443 [ACK] Seq=1138 Ack=132009 Win=4549 Len=0 TSval=1266382251 TSecr=2046872672","0.000052301"
"571","10.522439215","151.101.38.214","rust-bucket.local","TCP","1454","443  >  43784 [ACK] Seq=132009 Ack=557 Win=99 Len=1388 TSval=2046872672 TSecr=1266382007 [TCP segment of a reassembled PDU]",""
"572","10.522922094","151.101.38.214","rust-bucket.local","TCP","2842","443  >  43784 [ACK] Seq=133397 Ack=557 Win=99 Len=2776 TSval=2046872672 TSecr=1266382007 [TCP segment of a reassembled PDU]",""
"573","10.523171183","151.101.38.214","rust-bucket.local","TCP","1454","443  >  43784 [ACK] Seq=136173 Ack=557 Win=99 Len=1388 TSval=2046872672 TSecr=1266382007 [TCP segment of a reassembled PDU]",""
"574","10.523547310","151.101.38.214","rust-bucket.local","TCP","1454","443  >  43784 [ACK] Seq=137561 Ack=557 Win=99 Len=1388 TSval=2046872672 TSecr=1266382007 [TCP segment of a reassembled PDU]",""
"575","10.523874050","rust-bucket.local","151.101.38.214","TCP","66","43784  >  443 [ACK] Seq=1138 Ack=138949 Win=4549 Len=0 TSval=1266382253 TSecr=2046872672","0.000326740"
"576","10.528195428","151.101.38.214","rust-bucket.local","TCP","1454","443  >  43784 [ACK] Seq=138949 Ack=557 Win=99 Len=1388 TSval=2046872672 TSecr=1266382007 [TCP segment of a reassembled PDU]",""
"577","10.528323767","151.101.38.214","rust-bucket.local","TLSv1.2","561","Application Data",""
"578","10.528348592","rust-bucket.local","151.101.38.214","TCP","66","43784  >  443 [ACK] Seq=1138 Ack=140832 Win=4549 Len=0 TSval=1266382257 TSecr=2046872672","0.000024825"
"579","10.528618744","151.101.38.214","rust-bucket.local","TCP","1454","443  >  43784 [ACK] Seq=140832 Ack=650 Win=99 Len=1388 TSval=2046872674 TSecr=1266382024 [TCP segment of a reassembled PDU]","0.232821117"
"580","10.528902458","151.101.38.214","rust-bucket.local","TCP","1454","443  >  43784 [ACK] Seq=142220 Ack=650 Win=99 Len=1388 TSval=2046872674 TSecr=1266382024 [TCP segment of a reassembled PDU]",""
"581","10.529182072","151.101.38.214","rust-bucket.local","TCP","1454","443  >  43784 [ACK] Seq=143608 Ack=650 Win=99 Len=1388 TSval=2046872674 TSecr=1266382024 [TCP segment of a reassembled PDU]",""
"582","10.529275398","rust-bucket.local","151.101.38.214","TCP","66","43784  >  443 [ACK] Seq=1138 Ack=144996 Win=4549 Len=0 TSval=1266382258 TSecr=2046872674","0.000093326"
"583","10.534819060","151.101.38.214","rust-bucket.local","TCP","1454","443  >  43784 [ACK] Seq=144996 Ack=650 Win=99 Len=1388 TSval=2046872674 TSecr=1266382024 [TCP segment of a reassembled PDU]",""
"584","10.535012711","151.101.38.214","rust-bucket.local","TCP","1454","443  >  43784 [ACK] Seq=146384 Ack=650 Win=99 Len=1388 TSval=2046872674 TSecr=1266382024 [TCP segment of a reassembled PDU]",""
"585","10.535051774","rust-bucket.local","151.101.38.214","TCP","66","43784  >  443 [ACK] Seq=1138 Ack=147772 Win=4549 Len=0 TSval=1266382264 TSecr=2046872674","0.000039063"
"586","10.535640253","151.101.38.214","rust-bucket.local","TCP","2842","443  >  43784 [ACK] Seq=147772 Ack=650 Win=99 Len=2776 TSval=2046872674 TSecr=1266382024 [TCP segment of a reassembled PDU]",""
"587","10.535725741","151.101.38.214","rust-bucket.local","TCP","1454","443  >  43784 [ACK] Seq=150548 Ack=650 Win=99 Len=1388 TSval=2046872674 TSecr=1266382024 [TCP segment of a reassembled PDU]",""
"588","10.535876667","rust-bucket.local","151.101.38.214","TCP","66","43784  >  443 [ACK] Seq=1138 Ack=151936 Win=4549 Len=0 TSval=1266382265 TSecr=2046872674","0.000150926"
"589","10.536031818","151.101.38.214","rust-bucket.local","TCP","1454","443  >  43784 [ACK] Seq=151936 Ack=650 Win=99 Len=1388 TSval=2046872674 TSecr=1266382024 [TCP segment of a reassembled PDU]",""
"590","10.541177552","151.101.38.214","rust-bucket.local","TCP","1454","443  >  43784 [ACK] Seq=153324 Ack=650 Win=99 Len=1388 TSval=2046872674 TSecr=1266382024 [TCP segment of a reassembled PDU]",""
"591","10.541245127","rust-bucket.local","151.101.38.214","TCP","66","43784  >  443 [ACK] Seq=1138 Ack=154712 Win=4549 Len=0 TSval=1266382270 TSecr=2046872674","0.000067575"
"592","10.541388816","151.101.38.214","rust-bucket.local","TCP","1454","443  >  43784 [ACK] Seq=154712 Ack=650 Win=99 Len=1388 TSval=2046872674 TSecr=1266382024 [TCP segment of a reassembled PDU]",""
"593","10.546598863","151.101.38.214","rust-bucket.local","TLSv1.2","1211","Application Data",""
"594","10.546623950","rust-bucket.local","151.101.38.214","TCP","66","43784  >  443 [ACK] Seq=1138 Ack=157245 Win=4549 Len=0 TSval=1266382275 TSecr=2046872674","0.000025087"
"595","10.546910990","151.101.38.214","rust-bucket.local","TCP","1454","443  >  43784 [ACK] Seq=157245 Ack=650 Win=99 Len=1388 TSval=2046872674 TSecr=1266382024 [TCP segment of a reassembled PDU]",""
"596","10.547314980","151.101.38.214","rust-bucket.local","TCP","2842","443  >  43784 [ACK] Seq=158633 Ack=650 Win=99 Len=2776 TSval=2046872674 TSecr=1266382024 [TCP segment of a reassembled PDU]",""
"597","10.547563369","151.101.38.214","rust-bucket.local","TCP","1454","443  >  43784 [ACK] Seq=161409 Ack=650 Win=99 Len=1388 TSval=2046872674 TSecr=1266382024 [TCP segment of a reassembled PDU]",""
"598","10.547722083","151.101.38.214","rust-bucket.local","TLSv1.2","482","Application Data",""
"599","10.548056935","rust-bucket.local","151.101.38.214","TCP","66","43784  >  443 [ACK] Seq=1138 Ack=163213 Win=4549 Len=0 TSval=1266382277 TSecr=2046872674","0.000334852"
"600","10.548065622","151.101.38.214","rust-bucket.local","TCP","1454","443  >  43784 [ACK] Seq=163213 Ack=766 Win=99 Len=1388 TSval=2046872678 TSecr=1266382025 [TCP segment of a reassembled PDU]","0.252103457"
"601","10.552848329","151.101.38.214","rust-bucket.local","TCP","1454","443  >  43784 [ACK] Seq=164601 Ack=766 Win=99 Len=1388 TSval=2046872678 TSecr=1266382025 [TCP segment of a reassembled PDU]",""
"602","10.552901129","rust-bucket.local","151.101.38.214","TCP","66","43784  >  443 [ACK] Seq=1138 Ack=165989 Win=4549 Len=0 TSval=1266382282 TSecr=2046872678","0.000052800"
"603","10.558567854","151.101.38.214","rust-bucket.local","TCP","1454","443  >  43784 [ACK] Seq=165989 Ack=766 Win=99 Len=1388 TSval=2046872678 TSecr=1266382025 [TCP segment of a reassembled PDU]",""
"604","10.558629455","151.101.38.214","rust-bucket.local","TLSv1.2","471","Application Data",""
"605","10.558710330","rust-bucket.local","151.101.38.214","TCP","66","43784  >  443 [ACK] Seq=1138 Ack=167782 Win=4549 Len=0 TSval=1266382287 TSecr=2046872678","0.000080875"
"606","10.595270372","151.101.38.214","rust-bucket.local","TCP","66","443  >  43784 [ACK] Seq=167782 Ack=953 Win=99 Len=0 TSval=2046872694 TSecr=1266382067","0.241953814"
"607","10.606640548","151.101.38.214","rust-bucket.local","TCP","1454","443  >  43784 [ACK] Seq=167782 Ack=953 Win=99 Len=1388 TSval=2046872694 TSecr=1266382067 [TCP segment of a reassembled PDU]",""
"609","10.639505178","151.101.38.214","rust-bucket.local","TCP","66","443  >  43784 [ACK] Seq=169170 Ack=1138 Win=102 Len=0 TSval=2046872707 TSecr=1266382082","0.285961094"
"610","10.639580653","rust-bucket.local","151.101.38.214","TCP","66","43784  >  443 [ACK] Seq=1138 Ack=169170 Win=4549 Len=0 TSval=1266382368 TSecr=2046872694","0.032940105"
"611","10.650054435","151.101.38.214","rust-bucket.local","TCP","1454","443  >  43784 [ACK] Seq=169170 Ack=1138 Win=102 Len=1388 TSval=2046872708 TSecr=1266382158 [TCP segment of a reassembled PDU]",""
"612","10.650323874","151.101.38.214","rust-bucket.local","TCP","1454","443  >  43784 [ACK] Seq=170558 Ack=1138 Win=102 Len=1388 TSval=2046872708 TSecr=1266382158 [TCP segment of a reassembled PDU]",""
"613","10.650366112","rust-bucket.local","151.101.38.214","TCP","66","43784  >  443 [ACK] Seq=1138 Ack=171946 Win=4549 Len=0 TSval=1266382379 TSecr=2046872708","0.000042238"
"614","10.650616464","151.101.38.214","rust-bucket.local","TCP","1454","443  >  43784 [ACK] Seq=171946 Ack=1138 Win=102 Len=1388 TSval=2046872708 TSecr=1266382163 [TCP segment of a reassembled PDU]",""
"615","10.650887378","151.101.38.214","rust-bucket.local","TCP","1454","443  >  43784 [ACK] Seq=173334 Ack=1138 Win=102 Len=1388 TSval=2046872708 TSecr=1266382163 [TCP segment of a reassembled PDU]",""
"616","10.651143617","rust-bucket.local","151.101.38.214","TCP","66","43784  >  443 [ACK] Seq=1138 Ack=174722 Win=4549 Len=0 TSval=1266382380 TSecr=2046872708","0.000256239"
"617","10.667660989","151.101.38.214","rust-bucket.local","TCP","1454","443  >  43784 [ACK] Seq=174722 Ack=1138 Win=102 Len=1388 TSval=2046872716 TSecr=1266382185 [TCP segment of a reassembled PDU]",""
"618","10.680038571","151.101.38.214","rust-bucket.local","TCP","1454","443  >  43784 [ACK] Seq=176110 Ack=1138 Win=102 Len=1388 TSval=2046872716 TSecr=1266382185 [TCP segment of a reassembled PDU]",""
"619","10.680094847","rust-bucket.local","151.101.38.214","TCP","66","43784  >  443 [ACK] Seq=1138 Ack=177498 Win=4549 Len=0 TSval=1266382409 TSecr=2046872716","0.000056276"
"620","10.680272560","151.101.38.214","rust-bucket.local","TCP","1454","443  >  43784 [ACK] Seq=177498 Ack=1138 Win=102 Len=1388 TSval=2046872716 TSecr=1266382185 [TCP segment of a reassembled PDU]",""
"621","10.681120066","151.101.38.214","rust-bucket.local","TLSv1.2","5618","Application Data [TCP segment of a reassembled PDU]",""
"622","10.681246429","rust-bucket.local","151.101.38.214","TCP","66","43784  >  443 [ACK] Seq=1138 Ack=184438 Win=4549 Len=0 TSval=1266382410 TSecr=2046872716","0.000126363"
"623","10.681504656","151.101.38.214","rust-bucket.local","TCP","2842","443  >  43784 [ACK] Seq=184438 Ack=1138 Win=102 Len=2776 TSval=2046872716 TSecr=1266382185 [TCP segment of a reassembled PDU]",""
"624","10.681784708","151.101.38.214","rust-bucket.local","TLSv1.2","1454","Application Data [TCP segment of a reassembled PDU]",""
"625","10.681971684","rust-bucket.local","151.101.38.214","TCP","66","43784  >  443 [ACK] Seq=1138 Ack=188602 Win=4549 Len=0 TSval=1266382411 TSecr=2046872716","0.000186976"
"626","10.682058409","151.101.38.214","rust-bucket.local","TCP","1454","443  >  43784 [ACK] Seq=188602 Ack=1138 Win=102 Len=1388 TSval=2046872716 TSecr=1266382185 [TCP segment of a reassembled PDU]",""
"627","10.682328761","151.101.38.214","rust-bucket.local","TCP","1454","443  >  43784 [ACK] Seq=189990 Ack=1138 Win=102 Len=1388 TSval=2046872716 TSecr=1266382185 [TCP segment of a reassembled PDU]",""
"628","10.682369487","rust-bucket.local","151.101.38.214","TCP","66","43784  >  443 [ACK] Seq=1138 Ack=191378 Win=4549 Len=0 TSval=1266382411 TSecr=2046872716","0.000040726"
"630","10.702076429","151.101.38.214","rust-bucket.local","TCP","1454","443  >  43784 [ACK] Seq=191378 Ack=1138 Win=102 Len=1388 TSval=2046872716 TSecr=1266382185 [TCP segment of a reassembled PDU]",""
"631","10.714534699","151.101.38.214","rust-bucket.local","TCP","1454","443  >  43784 [ACK] Seq=192766 Ack=1138 Win=102 Len=1388 TSval=2046872716 TSecr=1266382185 [TCP segment of a reassembled PDU]",""
"632","10.714589912","rust-bucket.local","151.101.38.214","TCP","66","43784  >  443 [ACK] Seq=1138 Ack=194154 Win=4549 Len=0 TSval=1266382443 TSecr=2046872716","0.000055213"
"633","10.714787151","151.101.38.214","rust-bucket.local","TCP","1454","443  >  43784 [ACK] Seq=194154 Ack=1138 Win=102 Len=1388 TSval=2046872716 TSecr=1266382185 [TCP segment of a reassembled PDU]",""
"634","10.715251217","151.101.38.214","rust-bucket.local","TCP","2842","443  >  43784 [ACK] Seq=195542 Ack=1138 Win=102 Len=2776 TSval=2046872716 TSecr=1266382185 [TCP segment of a reassembled PDU]",""
"635","10.715337817","rust-bucket.local","151.101.38.214","TCP","66","43784  >  443 [ACK] Seq=1138 Ack=198318 Win=4549 Len=0 TSval=1266382444 TSecr=2046872716","0.000086600"
"636","10.715510718","151.101.38.214","rust-bucket.local","TCP","1454","443  >  43784 [ACK] Seq=198318 Ack=1138 Win=102 Len=1388 TSval=2046872716 TSecr=1266382185 [TCP segment of a reassembled PDU]",""
"637","10.715782920","151.101.38.214","rust-bucket.local","TCP","1454","443  >  43784 [ACK] Seq=199706 Ack=1138 Win=102 Len=1388 TSval=2046872716 TSecr=1266382190 [TCP segment of a reassembled PDU]",""
"638","10.715809658","rust-bucket.local","151.101.38.214","TCP","66","43784  >  443 [ACK] Seq=1138 Ack=201094 Win=4549 Len=0 TSval=1266382445 TSecr=2046872716","0.000026738"
"639","10.716062947","151.101.38.214","rust-bucket.local","TCP","1454","443  >  43784 [ACK] Seq=201094 Ack=1138 Win=102 Len=1388 TSval=2046872716 TSecr=1266382190 [TCP segment of a reassembled PDU]",""
"640","10.720632702","151.101.38.214","rust-bucket.local","TCP","1454","443  >  43784 [ACK] Seq=202482 Ack=1138 Win=102 Len=1388 TSval=2046872716 TSecr=1266382199 [TCP segment of a reassembled PDU]",""
"641","10.720695565","rust-bucket.local","151.101.38.214","TCP","66","43784  >  443 [ACK] Seq=1138 Ack=203870 Win=4549 Len=0 TSval=1266382449 TSecr=2046872716","0.000062863"
"642","10.720897654","151.101.38.214","rust-bucket.local","TLSv1.2","1454","Application Data [TCP segment of a reassembled PDU]",""
"643","10.721184681","151.101.38.214","rust-bucket.local","TCP","1454","443  >  43784 [ACK] Seq=205258 Ack=1138 Win=102 Len=1388 TSval=2046872716 TSecr=1266382199 [TCP segment of a reassembled PDU]",""
"644","10.721219231","rust-bucket.local","151.101.38.214","TCP","66","43784  >  443 [ACK] Seq=1138 Ack=206646 Win=4549 Len=0 TSval=1266382450 TSecr=2046872716","0.000034550"
"645","10.726016025","151.101.38.214","rust-bucket.local","TCP","1454","443  >  43784 [ACK] Seq=206646 Ack=1138 Win=102 Len=1388 TSval=2046872716 TSecr=1266382199 [TCP segment of a reassembled PDU]",""
"646","10.726271040","151.101.38.214","rust-bucket.local","TCP","1454","443  >  43784 [ACK] Seq=208034 Ack=1138 Win=102 Len=1388 TSval=2046872716 TSecr=1266382199 [TCP segment of a reassembled PDU]",""
"647","10.726304827","rust-bucket.local","151.101.38.214","TCP","66","43784  >  443 [ACK] Seq=1138 Ack=209422 Win=4549 Len=0 TSval=1266382455 TSecr=2046872716","0.000033787"
"648","10.726733343","151.101.38.214","rust-bucket.local","TCP","2842","443  >  43784 [ACK] Seq=209422 Ack=1138 Win=102 Len=2776 TSval=2046872716 TSecr=1266382199 [TCP segment of a reassembled PDU]",""
"649","10.726820993","rust-bucket.local","151.101.38.214","TCP","66","43784  >  443 [ACK] Seq=1138 Ack=212198 Win=4549 Len=0 TSval=1266382456 TSecr=2046872716","0.000087650"
"650","10.726992732","151.101.38.214","rust-bucket.local","TCP","1454","443  >  43784 [ACK] Seq=212198 Ack=1138 Win=102 Len=1388 TSval=2046872716 TSecr=1266382199 [TCP segment of a reassembled PDU]",""
"651","10.727271384","151.101.38.214","rust-bucket.local","TCP","1454","443  >  43784 [ACK] Seq=213586 Ack=1138 Win=102 Len=1388 TSval=2046872716 TSecr=1266382199 [TCP segment of a reassembled PDU]",""
"652","10.727293197","rust-bucket.local","151.101.38.214","TCP","66","43784  >  443 [ACK] Seq=1138 Ack=214974 Win=4549 Len=0 TSval=1266382456 TSecr=2046872716","0.000021813"
"653","10.727554461","151.101.38.214","rust-bucket.local","TCP","1454","443  >  43784 [ACK] Seq=214974 Ack=1138 Win=102 Len=1388 TSval=2046872716 TSecr=1266382199 [TCP segment of a reassembled PDU]",""
"654","10.731760551","151.101.38.214","rust-bucket.local","TCP","1454","443  >  43784 [ACK] Seq=216362 Ack=1138 Win=102 Len=1388 TSval=2046872716 TSecr=1266382199 [TCP segment of a reassembled PDU]",""
"655","10.731813851","rust-bucket.local","151.101.38.214","TCP","66","43784  >  443 [ACK] Seq=1138 Ack=217750 Win=4549 Len=0 TSval=1266382461 TSecr=2046872716","0.000053300"
"656","10.732000815","151.101.38.214","rust-bucket.local","TCP","1454","443  >  43784 [ACK] Seq=217750 Ack=1138 Win=102 Len=1388 TSval=2046872716 TSecr=1266382199 [TCP segment of a reassembled PDU]",""
"657","10.732271142","151.101.38.214","rust-bucket.local","TCP","1454","443  >  43784 [ACK] Seq=219138 Ack=1138 Win=102 Len=1388 TSval=2046872716 TSecr=1266382203 [TCP segment of a reassembled PDU]",""
"658","10.732291629","rust-bucket.local","151.101.38.214","TCP","66","43784  >  443 [ACK] Seq=1138 Ack=220526 Win=4549 Len=0 TSval=1266382461 TSecr=2046872716","0.000020487"
"659","10.732548781","151.101.38.214","rust-bucket.local","TLSv1.2","1454","Application Data [TCP segment of a reassembled PDU]",""
"660","10.732827308","151.101.38.214","rust-bucket.local","TCP","1454","443  >  43784 [ACK] Seq=221914 Ack=1138 Win=102 Len=1388 TSval=2046872721 TSecr=1266382210 [TCP segment of a reassembled PDU]",""
"661","10.732847608","rust-bucket.local","151.101.38.214","TCP","66","43784  >  443 [ACK] Seq=1138 Ack=223302 Win=4549 Len=0 TSval=1266382462 TSecr=2046872716","0.000020300"
"662","10.752123511","151.101.38.214","rust-bucket.local","TCP","1454","443  >  43784 [ACK] Seq=223302 Ack=1138 Win=102 Len=1388 TSval=2046872721 TSecr=1266382210 [TCP segment of a reassembled PDU]",""
"663","10.763685550","151.101.38.214","rust-bucket.local","TCP","1454","443  >  43784 [ACK] Seq=224690 Ack=1138 Win=102 Len=1388 TSval=2046872728 TSecr=1266382234 [TCP segment of a reassembled PDU]",""
"664","10.763761450","rust-bucket.local","151.101.38.214","TCP","66","43784  >  443 [ACK] Seq=1138 Ack=226078 Win=4549 Len=0 TSval=1266382492 TSecr=2046872721","0.000075900"
"665","10.763918476","151.101.38.214","rust-bucket.local","TLSv1.2","1454","Application Data [TCP segment of a reassembled PDU]",""
"666","10.764193566","151.101.38.214","rust-bucket.local","TCP","1454","443  >  43784 [ACK] Seq=227466 Ack=1138 Win=102 Len=1388 TSval=2046872728 TSecr=1266382234 [TCP segment of a reassembled PDU]",""
"667","10.764214153","rust-bucket.local","151.101.38.214","TCP","66","43784  >  443 [ACK] Seq=1138 Ack=228854 Win=4549 Len=0 TSval=1266382493 TSecr=2046872728","0.000020587"
"668","10.764501318","151.101.38.214","rust-bucket.local","TCP","1454","443  >  43784 [ACK] Seq=228854 Ack=1138 Win=102 Len=1388 TSval=2046872728 TSecr=1266382234 [TCP segment of a reassembled PDU]",""
"669","10.764889183","151.101.38.214","rust-bucket.local","TCP","1454","443  >  43784 [ACK] Seq=230242 Ack=1138 Win=102 Len=1388 TSval=2046872728 TSecr=1266382245 [TCP segment of a reassembled PDU]",""
"670","10.766401855","rust-bucket.local","151.101.38.214","TCP","66","43784  >  443 [ACK] Seq=1138 Ack=231630 Win=4549 Len=0 TSval=1266382495 TSecr=2046872728","0.001512672"
"671","10.769676914","151.101.38.214","rust-bucket.local","TCP","1454","443  >  43784 [ACK] Seq=231630 Ack=1138 Win=102 Len=1388 TSval=2046872728 TSecr=1266382245 [TCP segment of a reassembled PDU]",""
"672","10.769889441","151.101.38.214","rust-bucket.local","TCP","1454","443  >  43784 [ACK] Seq=233018 Ack=1138 Win=102 Len=1388 TSval=2046872728 TSecr=1266382247 [TCP segment of a reassembled PDU]",""
"673","10.770178018","151.101.38.214","rust-bucket.local","TCP","1454","443  >  43784 [ACK] Seq=234406 Ack=1138 Win=102 Len=1388 TSval=2046872728 TSecr=1266382247 [TCP segment of a reassembled PDU]",""
"674","10.770456545","151.101.38.214","rust-bucket.local","TCP","1454","443  >  43784 [ACK] Seq=235794 Ack=1138 Win=102 Len=1388 TSval=2046872728 TSecr=1266382247 [TCP segment of a reassembled PDU]",""
"675","10.771288650","rust-bucket.local","151.101.38.214","TCP","66","43784  >  443 [ACK] Seq=1138 Ack=237182 Win=4549 Len=0 TSval=1266382500 TSecr=2046872728","0.000832105"
"676","10.775590103","151.101.38.214","rust-bucket.local","TCP","1454","443  >  43784 [ACK] Seq=237182 Ack=1138 Win=102 Len=1388 TSval=2046872728 TSecr=1266382247 [TCP segment of a reassembled PDU]",""
"677","10.775710629","151.101.38.214","rust-bucket.local","TCP","1454","443  >  43784 [ACK] Seq=238570 Ack=1138 Win=102 Len=1388 TSval=2046872728 TSecr=1266382247 [TCP segment of a reassembled PDU]",""
"678","10.776175582","151.101.38.214","rust-bucket.local","TLSv1.2","2842","Application Data [TCP segment of a reassembled PDU]",""
"679","10.776430509","151.101.38.214","rust-bucket.local","TCP","1454","443  >  43784 [ACK] Seq=242734 Ack=1138 Win=102 Len=1388 TSval=2046872728 TSecr=1266382251 [TCP segment of a reassembled PDU]",""
"680","10.776709048","151.101.38.214","rust-bucket.local","TCP","1454","443  >  43784 [ACK] Seq=244122 Ack=1138 Win=102 Len=1388 TSval=2046872728 TSecr=1266382251 [TCP segment of a reassembled PDU]",""
"681","10.777428941","rust-bucket.local","151.101.38.214","TCP","66","43784  >  443 [ACK] Seq=1138 Ack=245510 Win=4549 Len=0 TSval=1266382506 TSecr=2046872728","0.000719893"
"682","10.781555181","151.101.38.214","rust-bucket.local","TCP","1454","443  >  43784 [ACK] Seq=245510 Ack=1138 Win=102 Len=1388 TSval=2046872728 TSecr=1266382253 [TCP segment of a reassembled PDU]",""
"683","10.781797107","151.101.38.214","rust-bucket.local","TCP","1454","443  >  43784 [ACK] Seq=246898 Ack=1138 Win=102 Len=1388 TSval=2046872728 TSecr=1266382253 [TCP segment of a reassembled PDU]",""
"684","10.781925033","rust-bucket.local","151.101.38.214","TCP","66","43784  >  443 [ACK] Seq=1138 Ack=248286 Win=4549 Len=0 TSval=1266382511 TSecr=2046872728","0.000127926"
"685","10.782620025","151.101.38.214","rust-bucket.local","TLSv1.2","4230","Application Data [TCP segment of a reassembled PDU]",""
"686","10.782824364","rust-bucket.local","151.101.38.214","TCP","66","43784  >  443 [ACK] Seq=1138 Ack=252450 Win=4549 Len=0 TSval=1266382512 TSecr=2046872728","0.000204339"
"687","10.782861564","151.101.38.214","rust-bucket.local","TCP","1454","443  >  43784 [ACK] Seq=252450 Ack=1138 Win=102 Len=1388 TSval=2046872728 TSecr=1266382253 [TCP segment of a reassembled PDU]",""
"688","10.782887939","151.101.38.214","rust-bucket.local","TCP","1454","443  >  43784 [ACK] Seq=253838 Ack=1138 Win=102 Len=1388 TSval=2046872728 TSecr=1266382257 [TCP segment of a reassembled PDU]",""
"689","10.783038403","rust-bucket.local","151.101.38.214","TCP","66","43784  >  443 [ACK] Seq=1138 Ack=255226 Win=4549 Len=0 TSval=1266382512 TSecr=2046872728","0.000150464"
"690","10.783154691","151.101.38.214","rust-bucket.local","TCP","1454","443  >  43784 [ACK] Seq=255226 Ack=1138 Win=102 Len=1388 TSval=2046872728 TSecr=1266382257 [TCP segment of a reassembled PDU]",""
"691","10.783406693","151.101.38.214","rust-bucket.local","TCP","1454","443  >  43784 [ACK] Seq=256614 Ack=1138 Win=102 Len=1388 TSval=2046872728 TSecr=1266382258 [TCP segment of a reassembled PDU]",""
"692","10.783481281","rust-bucket.local","151.101.38.214","TCP","66","43784  >  443 [ACK] Seq=1138 Ack=258002 Win=4549 Len=0 TSval=1266382512 TSecr=2046872728","0.000074588"
"693","10.787959548","151.101.38.214","rust-bucket.local","TCP","1454","443  >  43784 [ACK] Seq=258002 Ack=1138 Win=102 Len=1388 TSval=2046872728 TSecr=1266382258 [TCP segment of a reassembled PDU]",""
"697","10.789439583","151.101.38.214","rust-bucket.local","TCP","2842","443  >  43784 [ACK] Seq=259390 Ack=1138 Win=102 Len=2776 TSval=2046872739 TSecr=1266382264 [TCP segment of a reassembled PDU]",""
"698","10.789526946","151.101.38.214","rust-bucket.local","TCP","1454","443  >  43784 [ACK] Seq=262166 Ack=1138 Win=102 Len=1388 TSval=2046872739 TSecr=1266382265 [TCP segment of a reassembled PDU]",""
"699","10.789823448","151.101.38.214","rust-bucket.local","TCP","1454","443  >  43784 [ACK] Seq=263554 Ack=1138 Win=102 Len=1388 TSval=2046872739 TSecr=1266382265 [TCP segment of a reassembled PDU]",""
"700","10.789967461","rust-bucket.local","151.101.38.214","TCP","66","43784  >  443 [ACK] Seq=1138 Ack=264942 Win=4549 Len=0 TSval=1266382519 TSecr=2046872728","0.000144013"
"701","10.790095537","151.101.38.214","rust-bucket.local","TLSv1.2","1454","Application Data [TCP segment of a reassembled PDU]",""
"702","10.793776074","151.101.38.214","rust-bucket.local","TCP","1454","443  >  43784 [ACK] Seq=266330 Ack=1138 Win=102 Len=1388 TSval=2046872739 TSecr=1266382265 [TCP segment of a reassembled PDU]",""
"703","10.793825862","rust-bucket.local","151.101.38.214","TCP","66","43784  >  443 [ACK] Seq=1138 Ack=267718 Win=4549 Len=0 TSval=1266382523 TSecr=2046872739","0.000049788"
"704","10.800030490","151.101.38.214","rust-bucket.local","TCP","1454","443  >  43784 [ACK] Seq=267718 Ack=1138 Win=102 Len=1388 TSval=2046872739 TSecr=1266382270 [TCP segment of a reassembled PDU]",""
"705","10.806660647","151.101.38.214","rust-bucket.local","TCP","1454","443  >  43784 [ACK] Seq=269106 Ack=1138 Win=102 Len=1388 TSval=2046872739 TSecr=1266382270 [TCP segment of a reassembled PDU]",""
"706","10.806712660","rust-bucket.local","151.101.38.214","TCP","66","43784  >  443 [ACK] Seq=1138 Ack=270494 Win=4549 Len=0 TSval=1266382535 TSecr=2046872739","0.000052013"
"707","10.806776423","151.101.38.214","rust-bucket.local","TLSv1.2","348","Application Data",""
"708","10.806910298","rust-bucket.local","151.101.38.214","TCP","66","43784  >  443 [ACK] Seq=1138 Ack=270776 Win=4549 Len=0 TSval=1266382536 TSecr=2046872739","0.000133875"
"804","11.966278270","rust-bucket.local","151.101.38.214","TLSv1.2","208","Application Data",""
"805","11.973220541","rust-bucket.local","151.101.38.214","TLSv1.2","160","Application Data",""
"806","11.998210169","rust-bucket.local","151.101.38.214","TLSv1.2","154","Application Data",""
"807","12.008702388","rust-bucket.local","151.101.38.214","TLSv1.2","162","Application Data",""
"808","12.023224309","rust-bucket.local","151.101.38.214","TLSv1.2","162","Application Data",""
"809","12.074106158","rust-bucket.local","151.101.38.214","TLSv1.2","266","Application Data",""
"810","12.103060862","rust-bucket.local","151.101.38.214","TLSv1.2","109","Application Data",""
"811","12.103363526","rust-bucket.local","151.101.38.214","TLSv1.2","109","Application Data",""
"812","12.103825930","rust-bucket.local","151.101.38.214","TLSv1.2","109","Application Data",""
"813","12.103895667","rust-bucket.local","151.101.38.214","TLSv1.2","152","Application Data, Application Data",""
"827","12.217231967","151.101.38.214","rust-bucket.local","TCP","66","443  >  43784 [ACK] Seq=270776 Ack=1280 Win=104 Len=0 TSval=2046873103 TSecr=1266383695","0.250953697"
"828","12.217316080","151.101.38.214","rust-bucket.local","TCP","66","443  >  43784 [ACK] Seq=270776 Ack=1374 Win=104 Len=0 TSval=2046873103 TSecr=1266383702","0.244095539"
"829","12.217409881","151.101.38.214","rust-bucket.local","TCP","66","443  >  43784 [ACK] Seq=270776 Ack=1462 Win=104 Len=0 TSval=2046873103 TSecr=1266383727","0.219199712"
"830","12.222609465","151.101.38.214","rust-bucket.local","TLSv1.2","257","Application Data",""
"831","12.222702803","rust-bucket.local","151.101.38.214","TCP","66","43784  >  443 [ACK] Seq=2069 Ack=270967 Win=4549 Len=0 TSval=1266383951 TSecr=2046873103","0.000093338"
"832","12.222816091","151.101.38.214","rust-bucket.local","TCP","1454","443  >  43784 [ACK] Seq=270967 Ack=1462 Win=104 Len=1388 TSval=2046873103 TSecr=1266383727 [TCP segment of a reassembled PDU]",""
"833","12.222846779","rust-bucket.local","151.101.38.214","TCP","66","43784  >  443 [ACK] Seq=2069 Ack=272355 Win=4539 Len=0 TSval=1266383952 TSecr=2046873103","0.000030688"
"834","12.223900436","rust-bucket.local","151.101.38.214","TLSv1.2","108","Application Data",""
"835","12.228746218","151.101.38.214","rust-bucket.local","TCP","1454","443  >  43784 [ACK] Seq=272355 Ack=1462 Win=104 Len=1388 TSval=2046873103 TSecr=1266383727 [TCP segment of a reassembled PDU]",""
"836","12.228804844","151.101.38.214","rust-bucket.local","TLSv1.2","78","Application Data",""
"837","12.229042933","rust-bucket.local","151.101.38.214","TCP","66","43784  >  443 [ACK] Seq=2111 Ack=273755 Win=4549 Len=0 TSval=1266383958 TSecr=2046873103","0.000238089"
"838","12.229318997","151.101.38.214","rust-bucket.local","TLSv1.2","2854","Application Data",""
"839","12.229559524","151.101.38.214","rust-bucket.local","TCP","1454","443  >  43784 [ACK] Seq=276543 Ack=1462 Win=104 Len=1388 TSval=2046873103 TSecr=1266383727 [TCP segment of a reassembled PDU]",""
"840","12.229658787","rust-bucket.local","151.101.38.214","TCP","66","43784  >  443 [ACK] Seq=2111 Ack=277931 Win=4549 Len=0 TSval=1266383958 TSecr=2046873103","0.000099263"
"841","12.229851000","151.101.38.214","rust-bucket.local","TCP","1454","443  >  43784 [ACK] Seq=277931 Ack=1462 Win=104 Len=1388 TSval=2046873103 TSecr=1266383727 [TCP segment of a reassembled PDU]",""
"842","12.229940239","151.101.38.214","rust-bucket.local","TLSv1.2","78","Application Data",""
"843","12.235092673","151.101.38.214","rust-bucket.local","TCP","1454","443  >  43784 [ACK] Seq=279331 Ack=1462 Win=104 Len=1388 TSval=2046873103 TSecr=1266383727 [TCP segment of a reassembled PDU]",""
"844","12.235243699","151.101.38.214","rust-bucket.local","TCP","1454","443  >  43784 [ACK] Seq=280719 Ack=1462 Win=104 Len=1388 TSval=2046873103 TSecr=1266383727 [TCP segment of a reassembled PDU]",""
"845","12.235544888","151.101.38.214","rust-bucket.local","TLSv1.2","78","Application Data",""
"846","12.235573626","151.101.38.214","rust-bucket.local","TCP","1454","443  >  43784 [ACK] Seq=282119 Ack=1462 Win=104 Len=1388 TSval=2046873103 TSecr=1266383727 [TCP segment of a reassembled PDU]",""
"847","12.235807690","151.101.38.214","rust-bucket.local","TCP","1454","443  >  43784 [ACK] Seq=283507 Ack=1462 Win=104 Len=1388 TSval=2046873103 TSecr=1266383727 [TCP segment of a reassembled PDU]",""
"848","12.235908116","151.101.38.214","rust-bucket.local","TLSv1.2","78","Application Data",""
"849","12.236223793","151.101.38.214","rust-bucket.local","TCP","1454","443  >  43784 [ACK] Seq=284907 Ack=1462 Win=104 Len=1388 TSval=2046873103 TSecr=1266383727 [TCP segment of a reassembled PDU]",""
"850","12.237207362","rust-bucket.local","151.101.38.214","TCP","66","43784  >  443 [ACK] Seq=2111 Ack=286295 Win=4549 Len=0 TSval=1266383966 TSecr=2046873103","0.000983569"
"851","12.240681735","151.101.38.214","rust-bucket.local","TLSv1.2","1296","Application Data",""
"852","12.240880436","151.101.38.214","rust-bucket.local","TLSv1.2","1158","Application Data",""
"853","12.241282864","rust-bucket.local","151.101.38.214","TCP","66","43784  >  443 [ACK] Seq=2111 Ack=288617 Win=4549 Len=0 TSval=1266383970 TSecr=2046873103","0.000402428"
"854","12.241384914","151.101.38.214","rust-bucket.local","TLSv1.2","2854","Application Data",""
"855","12.241426202","rust-bucket.local","151.101.38.214","TCP","66","43784  >  443 [ACK] Seq=2111 Ack=291405 Win=4549 Len=0 TSval=1266383970 TSecr=2046873103","0.000041288"
"856","12.241619666","151.101.38.214","rust-bucket.local","TCP","1454","443  >  43784 [ACK] Seq=291405 Ack=1462 Win=104 Len=1388 TSval=2046873103 TSecr=1266383727 [TCP segment of a reassembled PDU]",""
"857","12.241924505","151.101.38.214","rust-bucket.local","TCP","1454","443  >  43784 [ACK] Seq=292793 Ack=1462 Win=104 Len=1388 TSval=2046873103 TSecr=1266383727 [TCP segment of a reassembled PDU]",""
"858","12.241978906","rust-bucket.local","151.101.38.214","TCP","66","43784  >  443 [ACK] Seq=2111 Ack=294181 Win=4549 Len=0 TSval=1266383971 TSecr=2046873103","0.000054401"
"859","12.242003131","151.101.38.214","rust-bucket.local","TLSv1.2","78","Application Data",""
"860","12.247750844","151.101.38.214","rust-bucket.local","TCP","1454","443  >  43784 [ACK] Seq=294193 Ack=1462 Win=104 Len=1388 TSval=2046873103 TSecr=1266383727 [TCP segment of a reassembled PDU]",""
"861","12.247807544","rust-bucket.local","151.101.38.214","TCP","66","43784  >  443 [ACK] Seq=2111 Ack=295581 Win=4549 Len=0 TSval=1266383977 TSecr=2046873103","0.000056700"
"862","12.248018196","151.101.38.214","rust-bucket.local","TCP","1454","443  >  43784 [ACK] Seq=295581 Ack=1462 Win=104 Len=1388 TSval=2046873103 TSecr=1266383727 [TCP segment of a reassembled PDU]",""
"863","12.248855039","151.101.38.214","rust-bucket.local","TLSv1.2","78","Application Data",""
"864","12.248911277","151.101.38.214","rust-bucket.local","TLSv1.2","2854","Application Data",""
"865","12.248932002","151.101.38.214","rust-bucket.local","TLSv1.2","2647","Application Data",""
"866","12.249336567","151.101.38.214","rust-bucket.local","TCP","66","443  >  43784 [ACK] Seq=302350 Ack=1654 Win=104 Len=0 TSval=2046873108 TSecr=1266383737","0.226112258"
"867","12.249459705","151.101.38.214","rust-bucket.local","TCP","2842","443  >  43784 [ACK] Seq=302350 Ack=1654 Win=104 Len=2776 TSval=2046873108 TSecr=1266383737 [TCP segment of a reassembled PDU]",""
"868","12.249534893","151.101.38.214","rust-bucket.local","TLSv1.2","78","Application Data",""
"869","12.249550568","151.101.38.214","rust-bucket.local","TCP","1454","443  >  43784 [ACK] Seq=305138 Ack=1654 Win=104 Len=1388 TSval=2046873108 TSecr=1266383737 [TCP segment of a reassembled PDU]",""
"870","12.249849708","151.101.38.214","rust-bucket.local","TCP","1454","443  >  43784 [ACK] Seq=306526 Ack=1654 Win=104 Len=1388 TSval=2046873108 TSecr=1266383737 [TCP segment of a reassembled PDU]",""
"871","12.249919721","151.101.38.214","rust-bucket.local","TLSv1.2","78","Application Data",""
"872","12.250565800","rust-bucket.local","151.101.38.214","TCP","66","43784  >  443 [ACK] Seq=2111 Ack=307926 Win=4549 Len=0 TSval=1266383979 TSecr=2046873103","0.000646079"
"873","12.260516166","151.101.38.214","rust-bucket.local","TCP","1454","443  >  43784 [ACK] Seq=307926 Ack=1654 Win=104 Len=1388 TSval=2046873108 TSecr=1266383737 [TCP segment of a reassembled PDU]",""
"874","12.260747392","151.101.38.214","rust-bucket.local","TCP","1454","443  >  43784 [ACK] Seq=309314 Ack=1654 Win=104 Len=1388 TSval=2046873108 TSecr=1266383737 [TCP segment of a reassembled PDU]",""
"875","12.260776080","rust-bucket.local","151.101.38.214","TCP","66","43784  >  443 [ACK] Seq=2111 Ack=310702 Win=4549 Len=0 TSval=1266383989 TSecr=2046873108","0.000028688"
"876","12.261786312","151.101.38.214","rust-bucket.local","TLSv1.2","78","Application Data",""
"877","12.261817787","151.101.38.214","rust-bucket.local","TLSv1.2","2854","Application Data",""
"878","12.261839112","151.101.38.214","rust-bucket.local","TLSv1.2","2854","Application Data",""
"879","12.261854937","151.101.38.214","rust-bucket.local","TCP","1454","443  >  43784 [ACK] Seq=316290 Ack=1654 Win=104 Len=1388 TSval=2046873108 TSecr=1266383737 [TCP segment of a reassembled PDU]",""
"880","12.262064639","rust-bucket.local","151.101.38.214","TCP","66","43784  >  443 [ACK] Seq=2111 Ack=317678 Win=4549 Len=0 TSval=1266383991 TSecr=2046873108","0.000209702"
"881","12.262492991","151.101.38.214","rust-bucket.local","TLSv1.2","1296","Application Data",""
"882","12.262529467","151.101.38.214","rust-bucket.local","TCP","4230","443  >  43784 [ACK] Seq=318908 Ack=1654 Win=104 Len=4164 TSval=2046873109 TSecr=1266383737 [TCP segment of a reassembled PDU]",""
"883","12.262701480","rust-bucket.local","151.101.38.214","TCP","66","43784  >  443 [ACK] Seq=2111 Ack=323072 Win=4549 Len=0 TSval=1266383991 TSecr=2046873108","0.000172013"
"884","12.262935694","151.101.38.214","rust-bucket.local","TCP","2842","443  >  43784 [ACK] Seq=323072 Ack=1654 Win=104 Len=2776 TSval=2046873109 TSecr=1266383737 [TCP segment of a reassembled PDU]",""
"885","12.263100508","rust-bucket.local","151.101.38.214","TCP","66","43784  >  443 [ACK] Seq=2111 Ack=325848 Win=4549 Len=0 TSval=1266383992 TSecr=2046873109","0.000164814"
"886","12.263201871","151.101.38.214","rust-bucket.local","TCP","1454","443  >  43784 [ACK] Seq=325848 Ack=1654 Win=104 Len=1388 TSval=2046873109 TSecr=1266383737 [TCP segment of a reassembled PDU]",""
"887","12.263493723","151.101.38.214","rust-bucket.local","TCP","1454","443  >  43784 [ACK] Seq=327236 Ack=1654 Win=104 Len=1388 TSval=2046873109 TSecr=1266383737 [TCP segment of a reassembled PDU]",""
"888","12.263516186","rust-bucket.local","151.101.38.214","TCP","66","43784  >  443 [ACK] Seq=2111 Ack=328624 Win=4549 Len=0 TSval=1266383992 TSecr=2046873109","0.000022463"
"889","12.263765387","151.101.38.214","rust-bucket.local","TCP","1454","443  >  43784 [ACK] Seq=328624 Ack=1654 Win=104 Len=1388 TSval=2046873109 TSecr=1266383737 [TCP segment of a reassembled PDU]",""
"890","12.272927873","151.101.38.214","rust-bucket.local","TCP","1454","443  >  43784 [ACK] Seq=330012 Ack=1654 Win=104 Len=1388 TSval=2046873109 TSecr=1266383737 [TCP segment of a reassembled PDU]",""
"891","12.272970973","rust-bucket.local","151.101.38.214","TCP","66","43784  >  443 [ACK] Seq=2111 Ack=331400 Win=4549 Len=0 TSval=1266384002 TSecr=2046873109","0.000043100"
"892","12.273173137","151.101.38.214","rust-bucket.local","TCP","1454","443  >  43784 [ACK] Seq=331400 Ack=1654 Win=104 Len=1388 TSval=2046873109 TSecr=1266383737 [TCP segment of a reassembled PDU]",""
"893","12.273446351","151.101.38.214","rust-bucket.local","TCP","1454","443  >  43784 [ACK] Seq=332788 Ack=1654 Win=104 Len=1388 TSval=2046873109 TSecr=1266383737 [TCP segment of a reassembled PDU]",""
"894","12.273461226","rust-bucket.local","151.101.38.214","TCP","66","43784  >  443 [ACK] Seq=2111 Ack=334176 Win=4549 Len=0 TSval=1266384002 TSecr=2046873109","0.000014875"
"895","12.273694553","151.101.38.214","rust-bucket.local","TLSv1.2","1211","Application Data",""
"896","12.273830979","151.101.38.214","rust-bucket.local","TLSv1.2","255","Application Data",""
"897","12.275786467","rust-bucket.local","151.101.38.214","TCP","66","43784  >  443 [ACK] Seq=2111 Ack=335510 Win=4549 Len=0 TSval=1266384004 TSecr=2046873109","0.001955488"
"898","12.305994717","151.101.38.214","rust-bucket.local","TCP","66","443  >  43784 [ACK] Seq=335510 Ack=1897 Win=106 Len=0 TSval=2046873125 TSecr=1266383803","0.202933855"
"899","12.318540100","151.101.38.214","rust-bucket.local","TCP","66","443  >  43784 [ACK] Seq=335510 Ack=1983 Win=106 Len=0 TSval=2046873128 TSecr=1266383832","0.214714170"
"900","12.366891544","151.101.38.214","rust-bucket.local","TCP","66","443  >  43784 [ACK] Seq=335510 Ack=2069 Win=106 Len=0 TSval=2046873141 TSecr=1266383833","0.262995877"
"906","12.500139263","151.101.38.214","rust-bucket.local","TLSv1.2","1175","Application Data",""
"907","12.543487587","rust-bucket.local","151.101.38.214","TCP","66","43784  >  443 [ACK] Seq=2111 Ack=336619 Win=4549 Len=0 TSval=1266384272 TSecr=2046873174","0.043348324"
"908","12.612316792","151.101.38.214","rust-bucket.local","TCP","66","443  >  43784 [ACK] Seq=336619 Ack=2111 Win=106 Len=0 TSval=2046873202 TSecr=1266383953","0.388416356"
"3743","57.795461767","rust-bucket.local","151.101.38.214","TCP","66","[TCP Keep-Alive] 43784  >  443 [ACK] Seq=2110 Ack=336619 Win=4549 Len=0 TSval=1266429524 TSecr=2046873202",""
"3758","58.166302388","151.101.38.214","rust-bucket.local","TCP","66","[TCP Keep-Alive ACK] 443  >  43784 [ACK] Seq=336619 Ack=2111 Win=106 Len=0 TSval=2046884580 TSecr=1266384272",""
